{
  "schema_version": "nlo-evaluation-record-v1",
  "evaluation_id": "eval-run-2026-03-13-016-review-01",
  "run_id": "run-2026-03-13-016",
  "evaluator": "operator-manual",
  "rubric_reference": "docs/review-checklist.md",
  "outcome": "rejected",
  "findings": [
    "preserved protected terms and literary tone well",
    "returned only the corrected passage with no reasoning leakage or commentary",
    "failed basic proofreading quality on core grammar",
    "introduced at least two clear errors: 'The path behind him were' and 'The child seen more'",
    "does not beat the current qwen2.5:14b baseline"
  ],
  "reviewed_at": "2026-03-13T21:00:00Z",
  "recorded_at": "2026-03-13T21:00:00Z",
  "notes": "stayed inside the output contract, but proofreading quality was not strong enough to challenge the current baseline",
  "converted_from": {
    "path": "evals/run-2026-03-13-016-review.md",
    "note": "findings converted from the review's Key Notes section"
  }
}
